{
  "$schema": "https://json-schema.org/draft/2020-12/schema",
  "$id": "https://educational-knowledge-platform.local/schemas/multilingual_retrieval_manifest_v1.schema.json",
  "title": "MIT 6.0001 Multilingual Dense Retrieval M2 Manifest v1",
  "type": "object",
  "additionalProperties": false,
  "required": [
    "$schema",
    "schema_version",
    "artifact_version",
    "status",
    "retrieval_run_id",
    "m1",
    "index",
    "retrieval",
    "execution",
    "validation",
    "artifacts",
    "software",
    "validation_status"
  ],
  "properties": {
    "$schema": {"type": "string"},
    "schema_version": {"const": "multilingual_retrieval_manifest_v1"},
    "artifact_version": {"const": "mit_60001_multilingual_m2_v1"},
    "status": {"const": "retrieval_complete"},
    "retrieval_run_id": {"type": "string"},
    "m1": {"type": "object"},
    "index": {"type": "object"},
    "retrieval": {"type": "object"},
    "execution": {"type": "object"},
    "validation": {"type": "object"},
    "artifacts": {"type": "object"},
    "software": {"type": "object"},
    "validation_status": {"const": "passed"}
  }
}
