{
  "$schema": "../../schemas/multilingual_retrieval_manifest_v1.schema.json",
  "schema_version": "multilingual_retrieval_manifest_v1",
  "artifact_version": "mit_60001_multilingual_m2_v1",
  "status": "retrieval_complete",
  "retrieval_run_id": "mit60001_multilingual_dense_50b89a8f56607868",
  "m1": {
    "paired_artifact_path": "evaluation/mit_60001/multilingual/paired_intents_v1.jsonl",
    "paired_artifact_sha256": "c416752a7bc83d956f8a95990bfb8ad0d40cd6ac905498bd656c6309b05c43da",
    "manifest_path": "evaluation/mit_60001/multilingual/m1_manifest.json",
    "manifest_sha256": "496a180d5fa8e30ab3dbbd95daed80d4ec799256023071a7a717e69528b431ef",
    "m1_artifact_version": "mit_60001_multilingual_m1_v1",
    "m1_status": "frozen"
  },
  "index": {
    "canonical_gold_sha256": "c03abf002c29b784d191eb393670da27b80fed8e0e18798f113d7ff8b7daf432",
    "index_manifest_path": "reports/09_embedding/embedding_index_manifest.json",
    "index_manifest_sha256": "4e8d277f630eff2c1a4b8e7721f449400e13f7e2c9fee4d99183270cc6ca388c",
    "index_run_id": "mit60001_index_558e4d6e873847dd",
    "index_content_sha256": "6e78f39257b7cc5defebd6740aab2dc1a4c202165b073f7a740ee5a5d7c46805",
    "embeddings_sha256": "3cf94fd32adf78e1e294d5562910f0d7144744a4c310de30f74f0084c80e56a7",
    "metadata_sha256": "376faf54d90b6c4a30dc562aeba2127cbdd2953c243cd341bc288068dce4c7d7",
    "chunk_id_order_sha256": "3d1d9d68fd8c9039d2a30ffe92933bb4e71c6488f8a60598998749945fa895db",
    "chunk_count": 861,
    "embedding_shape": [
      861,
      384
    ],
    "embedding_dtype": "float32",
    "index_backend": "numpy_exact_cosine_v1",
    "model_repository": "sentence-transformers/all-MiniLM-L6-v2",
    "model_revision": "1110a243fdf4706b3f48f1d95db1a4f5529b4d41"
  },
  "retrieval": {
    "retrieval_method": "dense_baseline_v1",
    "similarity": "cosine_via_dot_product_of_l2_normalized_vectors",
    "query_normalize_embeddings": true,
    "ranking_tie_break": "score_desc_then_chunk_id_asc",
    "retrieval_depth": 861,
    "exported_depth": 861,
    "canonical_metric_ranking_semantics": "full_corpus_ranking; M3 may derive first relevant rank without Top-K truncation",
    "canonical_k_values": [
      1,
      3,
      5,
      10
    ],
    "score_round_decimal_places": 8
  },
  "execution": {
    "number_of_intents": 20,
    "number_of_query_variants": 40,
    "query_variant_counts": {
      "en_canonical": 20,
      "vi_literal_en": 20
    },
    "query_source_fields": {
      "en_canonical": "question_en",
      "vi_literal_en": "literal_en"
    },
    "query_encoder_input_count": 40,
    "translator_calls": 0,
    "llm_calls": 0,
    "generator_calls": 0,
    "ground_truth_fields_used_for_retrieval": [],
    "quality_metrics_computed": false
  },
  "validation": {
    "retrieval_record_count": 40,
    "missing_intent_count": 0,
    "duplicate_branch_count": 0,
    "invalid_chunk_id_count": 0,
    "identical_query_pair_count": 2,
    "identical_query_result_equivalent_count": 2,
    "canonical_en_top_10_id_match_count": 20,
    "canonical_en_top_10_score_match_count": 20,
    "canonical_en_score_tolerance": 1e-06,
    "canonical_en_max_score_delta": 1.8e-07
  },
  "artifacts": {
    "results": {
      "path": "reports/27_multilingual_dense_retrieval/multilingual_dense_retrieval_results.jsonl",
      "sha256": "244861f3535e2875dee2c3dcd31b0b2af3ecdad91edf43e7af26abef02af3991",
      "record_count": 40
    },
    "result_schema": {
      "path": "schemas/multilingual_retrieval_result_v1.schema.json",
      "sha256": "e816ae1e65579e1d7454f0cba6a804f176ce8edccd64faa7d11801b4621ea4fc"
    },
    "canonical_retrieval_manifest": {
      "path": "reports/09_embedding/production_index_retrieval_manifest.json",
      "sha256": "47166f8bdc4ed998ac70286c048f38c9d57ee7c1a260e3fa2d918336f1ea34f6"
    },
    "canonical_retrieval_results": {
      "path": "reports/09_embedding/production_index_retrieval_results.csv",
      "sha256": "b3421ad828ee5165bd832cb1510b11e048c72ddd18b769e254018b2db5044833"
    }
  },
  "software": {
    "python_version": "3.12.10",
    "numpy_version": "2.4.3",
    "torch_version": "2.11.0+cpu",
    "transformers_version": "5.6.2",
    "sentence_transformers_version": "5.4.1"
  },
  "validation_status": "passed"
}
